{
  "layers": [
    {
      "expert_count": 16,
      "layer_id": 1,
      "top_k": 2,
      "windows": [
        {
          "base_weights_q32": [
            1342177280,
            1073741824,
            134217728,
            134217728,
            134217728,
            134217728,
            134217728,
            134217728,
            134217728,
            134217728,
            134217728,
            134217728,
            134217728,
            134217728,
            134217728,
            134217728
          ],
          "hotset": [
            0,
            1
          ],
          "hotset_boost_q16": 262144,
          "phase": 2,
          "source_bias_q16": [
            [
              65536,
              65536,
              65536,
              65536,
              65536,
              65536,
              65536,
              65536,
              65536,
              65536,
              65536,
              65536,
              65536,
              65536,
              65536,
              65536
            ]
          ],
          "sticky_expert_boost_q16": 65536,
          "window_ordinal": 0
        }
      ]
    }
  ],
  "route_profile_digest": "213649707c3f8efe6b02ec6c8ddf7adff8397517ff25c0c4453829b79df8f0e3",
  "route_window_tokens": 16,
  "schema": "moe_correlated_profile_v1",
  "version": 1
}
